{
  "schema_version": "1.0",
  "id": "synthetic-bindable",
  "name": "Synthetic Bindable Capability",
  "description": "Bindable capability requiring node-local binding registration.",
  "version": "1.0.0",
  "portability": "bindable",
  "requirements": {
    "os": ["win32", "darwin", "linux"],
    "bindings": ["OLLAMA_ENDPOINT"]
  },
  "entry_points": {
    "default": "scripts/main.js"
  },
  "self_test": {
    "script": "scripts/self-test.js"
  }
}
