{
  "schema_version": "1.0",
  "id": "synthetic-portable",
  "name": "Synthetic Portable Capability",
  "description": "Portable capability fixture with no external machine bindings.",
  "version": "1.0.0",
  "portability": "portable",
  "requirements": {
    "os": ["win32", "darwin", "linux"],
    "min_cpu_cores": 1,
    "min_ram_gb": 0.5
  },
  "entry_points": {
    "default": "scripts/main.js"
  },
  "self_test": {
    "script": "scripts/self-test.js"
  }
}
